,content,create_time,reference_time,score,nickname
67,"屏幕音效:屏幕很棒，显示超细腻，磁精的表面也很抗摔拍照效果:很棒，摄影有电影效果，玩玩也还弯好

运行速度:非常快，毫无卡顿,很跟手的感觉

待机时间: -天半是没有任何问题轻度使用

其他特色:小巧，精致，妥妥的小屏旗舰，没有之- - !",2022-02-19 11:24:23,2022-02-12 06:45:38,5,y***2
68,"很不错，粉色很亮，给女人使用最好，漂亮！机器用起来不卡顿，听说可以用很多年，系统是一大优势，长久耐用！
外形外观：时尚
屏幕音效：舒服
拍照效果：真实
运行速度：顺畅
待机时间：正常
其他特色：漂亮",2021-10-31 15:45:44,2021-10-27 00:21:33,5,****r
69,小的真的很迷你带上手机壳也很薄，然后很流畅，单手可以，我再也不用担心很沉了，之前买的别的手机玩久了，胳膊都是酸的，这个随便谁随便玩都没关系。,2022-03-06 13:05:12,2022-03-04 20:05:49,5,亲***苏
70,买给老婆的，她就喜欢小屏幕手机，听说明年不再出mini版本了，这是最后一款mini了，果断就下单了，这种小屏手机拿在手里确实很舒服，今年的iphone真的挺给力，优惠力度挺大的，物有所值，拍照也是好看的，记录美好生活，13是真的香,2021-10-16 17:36:36,2021-09-29 19:16:18,5,水***来
71,"外形外观：mini小巧精致
拍照效果：还可以吧
运行速度：杠杠滴&hellip;
待机时间：比12好太多

双十一抢的，价格便宜很多，京东自营的东西很好，服务及发货速度杠杠滴，支持京东做大做强",2021-11-18 01:12:02,2021-11-10 20:01:24,5,W***0
72,"外形外观：非常美观好看
屏幕音效：也非常美妙
拍照效果：非常清晰美丽
运行速度：特别流畅，特别快，非常满意，
待机时间：非常好，时间特别长，一下可以用好几天，特别理想
其他特色：每次都用苹果，确实很快！",2021-11-08 18:41:34,2021-10-31 13:45:29,5,****5
73,很小巧可爱的样子，老婆很喜欢，一直都是说喜欢用小手机，这个就刚好，适合手比较小的女生用,2021-12-24 15:23:00,2021-12-23 14:16:55,5,不***卿
74,手机已经收到，苹果手机质量真的可以，从晓8到现在的13手感好，适合我这个小手党，系统流畅，反应速度块，体验超级棒，总体非常喜欢，拍照像素好,2021-11-23 11:10:20,2021-11-11 09:15:56,5,卖***年
75,"外形外观：很nice百搭的颜色
屏幕音效：非常好明亮清晰，高耍玩游戏很舒服
拍照效果：对比12好了很多
运行速度：a15运行很丝滑
待机时间：正常使用十几个小时问题不大",2021-11-05 09:27:25,2021-11-03 15:12:12,5,C***0
76,"外形外观：小巧玲珑，单手操作
屏幕音效：一如既往的好
拍照效果：像素高清，放大看也很清晰
运行速度：非常快
待机时间：一天一充
其他特色：携带方便",2022-02-09 03:48:38,2022-01-24 12:39:16,5,A***6
77,"外形外观：很漂亮的星光白，单手操作的小巧机
屏幕音效：屏幕流畅，音效不错
拍照效果：拍照比之前的好很多，拍出来真实好看
运行速度：运行速度很快
待机时间：待机时间没具体测过，玩一天没问题",2022-01-15 21:42:59,2021-12-28 09:24:52,5,小***庐
78,安全下车，非常完美，小巧玲珑，握着很舒适，手感很好，看中的就是处理器，速度流畅，赞,2021-10-21 10:32:13,2021-10-19 13:56:05,5,****k
79,"给老公买的，他非常喜欢，收到货就开始拆包装，换卡，套壳。看到他很开心，我心情也美美哒。
外形外观：非常精致，很有质感
屏幕音效：非常清晰，音质也很好
拍照效果：比老公之前用的8好太多啦
运行速度：很流畅，不卡
待机时间：一天一充电，没有问题的哦
其他特色：大小合适，很轻。",2022-01-08 11:58:59,2021-12-31 20:06:47,5,L***0
80,"外形外观：非常好看 是我最喜欢的黑色 很稳重
屏幕音效：屏幕完美无瑕 音效非常适合
拍照效果：苹果拍照效果不用多说 朋友都喜欢用我的苹果拍
运行速度：极快 不愧是a15 根本无可匹敌
待机时间：超级长 苹果的续航越来越强
其他特色：性价比非常高 价格比以前的甚至略有降低",2022-02-22 19:20:34,2022-02-12 21:25:20,5,****5
81,东西昨天已经收到了，等了一个礼拜不到，苹果13mini比想象中的还要小，真的很小巧可爱，适合女生使用。外观比较典型的苹果风格。速度非常流畅，ios不是盖的。,2021-09-26 12:02:07,2021-09-19 12:09:25,5,****0
82,"外形外观：小巧精致，很轻。很适合自己
屏幕音效：和13没什么区别。就是尺寸不一样而已
拍照效果：感知不大。用苹果多年
运行速度：还是一样的顺滑
待机时间：一天到晚都可以接受。
其他特色：选适合自己的",2022-01-20 11:29:34,2022-01-10 11:43:36,5,弥***色
83,"大小刚好合适，小手机大屏幕，真的很香。感觉mini比13还要好用的呀！这个比8还小，但是屏幕比8大多了，真好用。内存128.再也不用担心存储不够用了！！
还有就是，活动价，加上京豆、e卡到手不到4k5，京东yyds.",2022-03-08 23:19:56,2022-02-06 09:48:21,5,你***过
84,"正品行货
外形外观：外面很漂亮，粉色的
屏幕音效：屏幕很清晰耐磨，
拍照效果：拍照效果好，
运行速度：运行速度快
待机时间：待机时间长
其他特色：其他特殊就是手机很小，单手握持很舒服，屏幕用起来很舒服。",2021-11-06 19:09:14,2021-11-01 00:29:37,5,蒋***学
85,"外形外观：屏幕很小，可以单手操作啊，很方便
拍照效果：立体感真的太好看了，一如既往好看
运行速度：运行速度很快啊
待机时间：还行吧",2022-02-18 10:06:05,2022-02-11 23:40:22,5,x***6
86,非常非常好，快递非非非常快，服务非常满意，屏幕一流，可以单手操作，轻盈舒适，绝对不会后悔，简直是太好了，完全对得起这个价格，无可挑剔！,2021-10-02 15:42:02,2021-10-01 19:03:52,5,****凌
87,iPhone 13mini尺寸真的是超级喜欢，蓝色yyds，毕竟是我最爱的颜色，拍照很清晰，算法处理的不错，简直同级无敌的存在，系统用起来也很流畅，缺点就是单卡，快充有点烫！喜欢的话就下手吧！,2021-11-18 11:01:00,2021-09-25 10:03:57,5,O***T
88,"第一款苹果手机是苹果7，用了四五年了，一点没卡过，屏幕碎了，但是不影响使用，喜欢这种小型机，干活方便，也很很可爱
特别是今年的价格，真是打动我的心
哈喽，你好，萨瓦迪卡，喜喜，我爱mini 13苹果手机",2021-09-27 20:25:07,2021-09-17 20:00:51,5,得***动
89,"外形外观：小巧可爱，是我喜欢的类型，之前用的11，这次买了这个小的，用起来很方便
拍照效果：很棒，
运行速度：嗖嗖的，无卡顿
待机时间：一天充一次电",2022-01-14 14:07:35,2021-12-04 12:31:41,5,x***1
90,"很不错啊，老婆很喜欢。
外形外观：大小合适，老婆手小。
运行速度：很快，6s战到现在不错了。
屏幕音效：色彩温和，不刺眼",2022-02-14 19:49:25,2022-02-12 22:53:01,5,哈***1
91,"外形外观：非常小巧美观，捏在手上刚刚好
屏幕音效：双音响，很立体，听歌看电视都非常舒服
拍照效果：拍照非常棒，很清晰，就是放大倍数不行
运行速度：处理器还不错，很快，日常使用完全没问题
待机时间：待机基本上几天一天一充。还行吧",2022-01-09 11:25:11,2022-01-08 16:28:59,5,晨***6
92,网上说iPhone13 mini有一些小问题，比如屏幕等。我在上个月20日收到货后，特意使用了10天才来评价。目前来看，13的A15芯片的确强劲，配合iOS15.2非常流畅迅速。mini的身材也是我这种单手控的人最喜欢的。新出的白色很好看，大摄像头也不显得突兀。电池续航比我之前的XR有了较大提升，轻松点可以两天一充。总体来说，这个手机买的非常满意。,2022-01-01 20:11:19,2021-12-19 15:36:42,5,P***g
93,"好小啊这手机，打电话都怕麦克风收不到声音，哈哈哈
拍照效果：一般吧，
运行速度：无敌
屏幕音效：很舒服
待机时间：一晚掉电3%
其他特色：返回真是反人类，绝对是一大特色了",2021-12-11 08:36:59,2021-12-05 22:48:13,5,易***0
94,"外形外观：小巧可爱
屏幕音效：很好
拍照效果：和12pm一样的摄像头，很好
运行速度：很快，a15不开玩笑
待机时间：续航很强",2021-11-29 18:50:12,2021-11-29 08:02:30,5,雨***E
95,"外形外观：外观简直太喜欢。主要还是喜欢这个小小的。
屏幕音效：音效很棒。没杂音。很清晰
拍照效果：苹果原相机懂的都懂
运行速度：运行速度杠杠的
待机时间：待机时间反正我用一天不用充电。我不玩游戏。",2021-10-13 11:01:23,2021-10-12 17:24:19,5,嘻***你
96,"外形外观：外形不错，挺好看的。
屏幕音效：屏幕挺好的，非常清晰，音效不错，非常清楚。
拍照效果：拍照非常清晰。
运行速度：运行速度非常快。
待机时间：作为一个备用手机，待机绝对够了。
其他特色：东西不错，非常满意，以后有需要还会再来光顾的。",2021-12-23 19:37:11,2021-12-22 22:58:51,5,峥***峥
97,"很早就拿到了,用了一段时间，拍照清晰,分辨率高,运行不发热,极速充电,外观好看,手感 错,正品,系统流畅,色彩饱和度不错,界面美观,屏幕很大绝绝子!买它",2021-11-10 09:57:44,2021-10-28 08:16:05,5,怵***v
98,"外形外观：非常漂亮，小巧玲珑，手感非常好人适合手小的和女士  值得购买
屏幕音效：屏幕小巧  色彩靓丽  声音浑厚
拍照效果：画面细腻  漂亮  色彩丰富 焦距也适合
运行速度：速度很快  5g确实快  信号?也挺好",2021-12-18 01:40:47,2021-12-11 20:05:21,5,如***7
99,等了好久，抢了好久！终于到手了，小屏太舒服了，迷你小巧，拿在手里又轻又舒服！红色大爱，特别好看！真不错！,2021-10-04 21:57:45,2021-10-03 09:50:52,5,****r
